"UID ","traIt","vaLue","tImestamp","Person","loCation","NUMBer "
"1","agroforestry with established tree cover","False","2017-08-10 18:09:53+1200","Peter","","1"
"1","agroforestry with established tree cover ","True  ","2017-08-10 18:09:53+2300","Peter","","1"
"1_T1","Variety name (text)", "Marsellesa","2017-08-10 18:09:53+0105","Peter","","1"
"1_T1","El Frances code (text)", "new","2017-08-10 18:09:53+0100","Peter","","1"
"1_T1","custom name", "new","2017-08-10 18:09:53+0100","Peter","","1"
"1_B1","Organic fertiliser application density (kg/ha) ","150","2017-08-10 18:09:53+0105","Peter","","1"